****SAILOR TABLE*******
SQL> CREATE TABLE SAILOR(SID INT NOT NULL,SNAME VARCHAR(15),RATING INT,AGE DECIMAL(10,2));
INSERT INTO SAILOR VALUES (1,'SAM',4,40.6); 
SQL> SELECT * FROM SAILOR;                   
ALTER TABLE SAILOR ADD PRIMARY KEY(SID);                                                                                                            
                                                                                                                                                        
       SID SNAME               RATING        AGE                                                                                                        
---------- --------------- ---------- ----------                                                                                                        
         1 SAM                      4       40.6                                                                                                        
         2 TOM                      5       50.2                                                                                                        
         3 JACK                     3       30.9                                                                                                        
         4 ROMAN                    4       25.1                                                                                                        
         5 TONY                     2         35                                                                                                        
         6 VICTOR                   4       32.1  
                                                                                                                                                                                                                  
 
 ****BOATS TABLE******
 SQL> CREATE TABLE BOATS(BID INT NOT NULL,BNAME VARCHAR(15),COLOR VARCHAR(10)); 
 SQL> INSERT INTO BOATS VALUES (101,'BOAT1','RED');
 SQL> SELECT * FROM BOATS                                                                                                                                
  2  ;                
  SQL> ALTER TABLE BOATS ADD PRIMARY KEY(BID);                                                                                                            
                                                                                                                                    
                                                                                                                                                        
       BID BNAME           COLOR                                                                                                                        
---------- --------------- ----------                                                                                                                   
       101 BOAT1           RED                                                                                                                          
       102 BOAT2           GREEN                                                                                                                        
       103 BOAT3           BLUE                                                                                                                         
       104 BOAT4           PURPLE                                                                                                                       
       105 BOAT5           RED                                                                                                                            
         
   *****RESERVES TABLE*******
 SQL> CREATE TABLE RESERVES(SID INT NOT NULL,BID INT NOT NULL,DAY DATE); 
 SQL> INSERT INTO RESERVES VALUES (1,102,'8-MAR-2024'); 
 SQL> SELECT * FROM RESERVES;        
 SQL> ALTER TABLE RESERVES ADD FOREIGN KEY(SID) REFERENCES SAILOR(SID);    
 SQL> ALTER TABLE RESERVES ADD FOREIGN KEY(BID) REFERENCES BOATS(BID);                                 
                                                                                                                                                                                                         
Table altered.                                                                                                                                          
                                          
                                                                                                                                                        
       SID        BID DAY                                                                                                                               
---------- ---------- ---------                                                                                                                         
         1        102 08-MAR-24                                                                                                                         
         1        105 15-MAR-24                                                                                                                         
         4        101 13-MAR-24                                                                                                                         
         3        102 14-MAR-24                                                                                                                         
         5        104 01-APR-24                                                                                                                         
         2        101 01-MAR-24                                                                                                                            
         
                      
 ***Find all information of sailors who have reserved boat number 101*******
 SQL> SELECT * FROM SAILOR JOIN RESERVES ON SAILOR.SID=RESERVES.SID WHERE BID=101;                                                                       
                                                                                                                                                        
       SID SNAME               RATING        AGE        SID        BID DAY                                                                              
---------- --------------- ---------- ---------- ---------- ---------- ---------                                                                        
         2 TOM                      5       50.2          2        101 01-MAR-24                                                                        
         4 ROMAN                    4       25.1          4        101 13-MAR-24   
         
  ****** Update the color of the boat from ‘Red’ to ‘Blue’***
 UPDATE BOATS SET COLOR='BLUE' WHERE COLOR='RED';                                                                                                   
                                                                                                                                                        
2 rows updated.                                                                                                                                         
                                                                                                                                                        
Commit complete.                                                                                                                                        
SQL> SELECT * FROM BOATS;                                                                                                                               
                                                                                                                                                        
       BID BNAME           COLOR                                                                                                                        
---------- --------------- ----------                                                                                                                   
       101 BOAT1           BLUE                                                                                                                         
       102 BOAT2           GREEN                                                                                                                        
       103 BOAT3           BLUE                                                                                                                         
       104 BOAT4           PURPLE                                                                                                                       
       105 BOAT5           BLUE                                                                                                                         
                                                                                                                                                        
*****Find the names of sailors who have reserved at least one boat.*****
SELECT SAILOR.SID,SNAME FROM SAILOR  WHERE SAILOR.SID IN(SELECT SID FROM RESERVES GROUP BY SID HAVING COUNT(SID)>=1);                              
                                                                                                                                                        
       SID SNAME                                                                                                                                        
---------- ---------------                                                                                                                              
         1 SAM                                                                                                                                          
         2 TOM                                                                                                                                          
         3 JACK                                                                                                                                         
         4 ROMAN                                                                                                                                        
         5 TONY   
         
         
  **** 6. Find the ids and names of sailors who have reserved two different boats on the same day.****
        select sid,sname from sailor where sid in (select r1.sid from reserves r1 join reserves r2 on r1.day=r2.day where r1.bid!=r2.bid)order by sid;     
                                                                                                                                                        
       SID SNAME                                                                                                                                        
---------- ---------------                                                                                                                              
         1 SAM                                                                                                                                          
         2 TOM                                                                                                                                          
                                                                                                                                                        
 
 *****7.Find the ids of sailors who have reserved a red boat or a green boat.*******
 SELECT SAILOR.SID,SNAME,RESERVES.BID FROM SAILOR JOIN RESERVES ON SAILOR.SID=RESERVES.SID WHERE RESERVES.BID IN(SELECT BID FROM BOATS WHERE COLOR='
PURPLE' OR COLOR='GREEN' GROUP BY BID);
                                                                                                                                                        
       SID SNAME                  BID                                                                                                                   
---------- --------------- ----------                                                                                                                   
         3 JACK                   102                                                                                                                   
         1 SAM                    102                                                                                                                   
         5 TONY                   104  
         
      *****8. Find the ids of sailors who have reserved neither a red boat nor a green boat****
   SELECT SAILOR.SID,SNAME,RESERVES.BID FROM SAILOR JOIN RESERVES ON SAILOR.SID=RESERVES.SID WHERE RESERVES.BID NOT IN(SELECT BID FROM BOATS WHERE COL
OR='PURPLE' OR COLOR='GREEN' GROUP BY BID);

                                                                                                                                                        
       SID SNAME                  BID                                                                                                                   
---------- --------------- ----------                                                                                                                   
         2 TOM                    101                                                                                                                   
         4 ROMAN                  101                                                                                                                   
         1 SAM                    105     
         
   ******9. Find the names of sailors who have reserved boat 103. (Use correlated nested query).****
    SELECT SNAME,SID FROM SAILOR WHERE SAILOR.SID IN(SELECT SID FROM RESERVES,SAILOR WHERE BID=104 AND WHERE SAILOR.SID=RESERVES.SID GROUP BY SID);                                             


SNAME                  SID                                                                                                                              
--------------- ----------                                                                                                                              
TONY                     5      
***9TH 	QN**
SQL> SELECT SID,SNAME FROM SAILOR WHERE SID IN (SELECT SAILOR.SID FROM RESERVES,SAILOR WHERE BID=104 AND RESERVES.SID=SAILOR.SID GROUP BY RESERVES.SID);


       SID SNAME                                                                                                                                        
---------- ---------------                                                                                                                              
         1 SAM                                                                                                                                          
         5 TONY                
****9TH QN using correlated nested query****

select Sid, name from sailor s where exists (select * from reserves r where r.sid=s.sid and bid=102);                                                             
                                                                                                                                                                       
       SID SNAME                                                                                                                                                       
---------- ---------------                                                                                                                                             
         1 SAM                                                                                                                                                         
         3 JACK                                                                                                                                                        
         4 ROMAN                                                                                                                                  

******10.Find the average age of sailors for each rating level.*****
SELECT RATING,AVG(AGE) FROM SAILOR GROUP BY RATING;                                                                                                
                                                                                                                                                        
    RATING   AVG(AGE)                                                                                                                                   
---------- ----------                                                                                                                                   
         2         35                                                                                                                                   
         4       32.6                                                                                                                                   
         5       50.2                                                                                                                                   
         3       30.9      
         
         ****11.Find the average age of sailors for each rating level that has at least two sailors.*****
         SELECT RATING,AVG(AGE),COUNT(RATING) FROM SAILOR GROUP BY RATING HAVING COUNT(RATING)>=2 ;                                                         
                                                                                                                                                        
    RATING   AVG(AGE) COUNT(RATING)                                                                                                                     
---------- ---------- -------------                                                                                                                     
         4       32.6             3    
   
    ****12.List all sailors’ information along with the boat id if they have reserved for one otherwise null.*****
 select s.sid,sname,rating,age,bid from sailor s left join reserves r on s.sid=r.sid;                                                                                                                            
                                                                                                                                                        
       SID SNAME               RATING        AGE        BID                                                                                             
---------- --------------- ---------- ---------- ----------                                                                                             
         1 SAM                      4       40.6        101                                                                                             
         1 SAM                      4       40.6        104                                                                                             
         1 SAM                      4       40.6        102                                                                                             
         1 SAM                      4       40.6        105                                                                                             
         1 SAM                      4       40.6        103                                                                                             
         2 TOM                      5       50.2        101                                                                                             
         3 JACK                     3       30.9        102                                                                                             
         4 ROMAN                    4       25.1        101                                                                                             
         5 TONY                     2         35        104                                                                                             
         6 VICTOR                   4       32.1                                                                                                        
         7 DANNY                    2         55                                                                                                        
                                                                                                                                                        
         
   ****13.Find all sailors id who have reserved boat(s) between 28.2.2024 and 05.3.2024.*****
    SELECT SID FROM RESERVES WHERE DAY BETWEEN '28-FEB-24' AND '5-MAR-2024';                                                                           
                                                                                                                                                        
       SID                                                                                                                                              
----------                                                                                                                                              
         2      
         
         ****14.Display the age of the Sailors 15 years from today .*****
    SQL> SELECT SNAME,AGE+15 AS AGE FROM SAILOR;                                                                                                            
                                                                                                                                                        
SNAME                  AGE                                                                                                                              
--------------- ----------                                                                                                                              
SAM                   55.6                                                                                                                              
TOM                   65.2                                                                                                                              
JACK                  45.9                                                                                                                              
ROMAN                 40.1                                                                                                                              
TONY                    50                                                                                                                              
VICTOR                47.1

*****SPOT****

    *****1. Find the names and ratings of sailor whose rating is better than some sailor called XXX.*****   
  SQL> SELECT SID,SNAME,RATING FROM SAILOR WHERE RATING > (SELECT RATING FROM SAILOR WHERE SNAME='JACK');                                                 
                                                                                                                                                        
       SID SNAME               RATING                                                                                                                   
---------- --------------- ----------                                                                                                                   
         1 SAM                      4                                                                                                                   
         2 TOM                      5                                                                                                                   
         4 ROMAN                    4                                                                                                                   
         6 VICTOR                   4      
         
      *****2. Find the names of sailors who have reserved all boats.*****
select sid,sname from sailor where sid in (select sid from reserves group by sid having count(bid)=(select count(bid) from boats));                               
                                                                                                                                                                       
       SID SNAME                                                                                                                                                       
---------- ---------------                                                                                                                                             
         1 SAM                                                                                                                                                         
                    
       ****3. Find the name and the age of the youngest sailor.****
    SQL> SELECT SNAME,AGE FROM SAILOR WHERE AGE = (SELECT MIN(AGE) FROM SAILOR);                                                                            
                                                                                                                                                        
SNAME                  AGE                                                                                                                              
--------------- ----------                                                                                                                              
ROMAN                 25.1                      
                
                
                                                                                                                                                                                                                     
SQL> INSERT INTO SAILOR VALUES (7,'DANNY',1,55);                                                                                                        
                                                                                                                                                        
1 row created.                                                                                                                                          
                                                                                                                                                        
Commit complete.  

***4. Increase the rating of the sailor by 1 if his current rating is 1.*****
                                                                                                                                      
SQL> UPDATE SAILOR SET RATING=2 WHERE RATING=1;                                                                                                         
                                                                                                                                                        
1 row updated.                                                                                                                                          
                                                                                                                                                        
Commit complete.                                                                                                                                        
SQL> SELECT * FROM SAILOR;                                                                                                                              
                                                                                                                                                        
       SID SNAME               RATING        AGE                                                                                                        
---------- --------------- ---------- ----------                                                                                                        
         1 SAM                      4       40.6                                                                                                        
         2 TOM                      5       50.2                                                                                                        
         3 JACK                     3       30.9                                                                                                        
         4 ROMAN                    4       25.1                                                                                                        
         5 TONY                     2         35                                                                                                        
         6 VICTOR                   4       32.1                                                                                                        
         7 DANNY                    2         55                                                                                                        
                                                                                                                                                        
7 rows selected.                                                                                                                                        
           ****5. Find the boat that was reserved for more than 10 times. ****
                                                                                                                                                       
***BOAT BOOKED ATLEAST TIMES ****
SQL> SELECT BNAME,BID FROM BOATS WHERE BID IN(SELECT BID FROM RESERVES GROUP BY BID HAVING COUNT(BID)>=2);                                              
                                                                                                                                                        
BNAME                  BID                                                                                                                              
--------------- ----------                                                                                                                              
BOAT2                  102                                                                                                                              
BOAT1                  101                                                                                                                              
                                                                                                                                                        
 
                                                                                                                 
         
                                                                                                                                                                                                                                                                                                                                                                                                                                                                                       
                                                                                                                                               
                                                                                                                                                                       
